10,Financial statements,Unnamed: 0
10.0,Income Statement and Statement,nan
nan,of comprehensive income for the,"In 1983, BMW Finance N.V. (hereafter also referred to as the “Company”) was founded as a wholly owned"
nan,year ended 31 December 2023,nan
11.0,Balance Sheet at 31 December,"subsidiary of BMW Holding B.V., who in turn is a wholly owned subsidiary of BMW Intec Beteiligungs GmbH, a"
nan,2023,nan
12.0,Cash Flow Statement for the year,"wholly owned subsidiary of BMW AG, and incorporated in the Netherlands. The main purpose of the Company"
