12,Cash Flow Statement for the year,The offsetting of the financial assets and liabilities for,similar contracts are in place actual offsetting would
nan,ended 31 December 2023,derivatives with external parties of the Company is,"in principle be possible, for instance in the case of"
13.0,Statement of Changes in Equity,nan,nan
14.0,Notes to the Financial Statements,taken into account. Actual balance sheet netting does,insolvency of the counterparty. Offsetting would have
15.0,1. Significant accounting policies,nan,nan
19.0,2. Interest income and expense,not occur due to non-fulfilment of required conditions.,the following impact on the balance sheet values of
