Unnamed: 0,"Year Ended December 31,",Unnamed: 2,Unnamed: 3,Unnamed: 4,Unnamed: 5,Unnamed: 6,Unnamed: 7,Unnamed: 9,Unnamed: 10
nan,2022,nan,nan,2021.0,nan,nan,2020,nan,nan
Net income,$,"12,587",nan,nan,$,"5,644",nan,$,862
Other comprehensive (loss) income:,nan,nan,nan,nan,nan,nan,nan,nan,nan
Foreign currency translation adjustment,nan,(392,),nan,nan,(308,),nan,399
Unrealized net loss on investments,nan,(23,),nan,nan,(1,),nan,—
Comprehensive income,nan,"12,172",nan,nan,nan,"5,335",nan,nan,"1,261"
Less: Comprehensive income attributable to noncontrolling interests and redeemable noncontrolling interests in subsidiaries,nan,31,nan,nan,nan,125,nan,nan,141
Comprehensive income attributable to common stockholders,$,"12,141",nan,nan,$,"5,210",nan,$,"1,120"
